{
  "verdict": "accept",
  "reviewed_artifact": "home:issue.md",
  "analysis_performed": "The issue is shaped, the repo path is real, and the next coding step is clear.",
  "findings_first": "The architect pass is ready for development.",
  "current_artifact": "home:issue.md",
  "next_owner": "developer",
  "failure_detail": null
}
